{"schema": "number-one-inventory-envelope/v2", "scan_id": "e4cb43ea-7387-48a2-9d91-781d910f33ab", "sequence": 1, "manifest": {"coverage": [{"artifact": "transcripts/bookmark-narrative-brief.json", "status": "absent"}, {"artifact": "transcripts/manual-clip-layout.json", "status": "absent"}, {"artifact": "transcripts/prep-manifest.json", "status": "absent"}, {"artifact": "transcripts/safe-intake-supporting-links.json", "status": "absent"}, {"artifact": "transcripts/source-watch.json", "status": "absent"}, {"artifact": "transcripts/supporting-clip-candidates.json", "status": "absent"}], "episode": {"id": "episode_616a1ec58e997fd5fb97fa27ec48153b57e83418ab576c463c537533a6f29e72", "number": 127, "show": "twib"}, "idempotency_digest": "sha256:12b6346235335e1a7a95994daeb7757c464da4214cd7f4f157f44863cf1036e3", "items": [{"id": "item_4eb3c6161aae0fe2e69ae5c1c56b455f882d2890b429c39a833bf700c49e640a", "kind": "media", "media": {"duration_seconds": null, "modified_at": "2026-10-12T18:05:41.844531Z", "present": true, "ref": "clip%25.mp4", "size_bytes": 7}, "observations": [], "origins": [], "processing_status": "unverified", "ready": false}], "observed_at": "2026-10-12T18:05:41.844582Z", "scan_finished_at": "2026-10-12T18:05:41.845381Z", "schema": "number-one-twib-inventory/v1", "snapshot": {"allow_deletions": false, "candidate_coverage": "partial", "complete": true, "consistency": "metadata_double_scan_not_atomic", "mode": "full", "scope": "episode_media_and_allowlisted_local_artifacts"}, "source_id": "nomad:number-one", "warnings": ["global_history_not_scanned", "local_artifacts_only_no_provider_polling", "not_atomic_deletions_disabled", "readiness_not_evaluated"]}}