{
  "schema": "number-one-inventory-envelope/v2",
  "scan_id": "00000000-0000-4000-8000-000000000001",
  "sequence": 1,
  "manifest": {
    "coverage": [
      {
        "artifact": "capture-required/example.capture-required.json",
        "status": "read"
      },
      {
        "artifact": "transcripts/bookmark-narrative-brief.json",
        "status": "absent"
      },
      {
        "artifact": "transcripts/manual-clip-layout.json",
        "status": "absent"
      },
      {
        "artifact": "transcripts/prep-manifest.json",
        "status": "absent"
      },
      {
        "artifact": "transcripts/safe-intake-supporting-links.json",
        "status": "absent"
      },
      {
        "artifact": "transcripts/source-watch.json",
        "status": "read"
      },
      {
        "artifact": "transcripts/supporting-clip-candidates.json",
        "status": "absent"
      }
    ],
    "episode": {
      "id": "episode_616a1ec58e997fd5fb97fa27ec48153b57e83418ab576c463c537533a6f29e72",
      "number": 127,
      "show": "twib"
    },
    "idempotency_digest": "sha256:077da6866276124b6d04994fb0395c3566698f21b6f00611a9aaf936ef9d8daa",
    "items": [
      {
        "id": "item_5df3ccbebcafd0f9e18302a3793fef5a776a8ce0e042d7d980264d51609e7046",
        "kind": "candidate",
        "media": null,
        "observations": [
          {
            "artifact": "capture-required/example.capture-required.json",
            "context": {},
            "failure_classes": [
              "downloader_failed"
            ],
            "status": "capture_required",
            "timestamps": {
              "created_at": "2026-10-12T10:01:00Z"
            }
          },
          {
            "artifact": "transcripts/source-watch.json",
            "context": {
              "listen_for": "The implementation timeline",
              "title": "Synthetic policy interview",
              "why": "Synthetic example: explain the policy change."
            },
            "metrics": {
              "duration_seconds": 120
            },
            "status": "candidate",
            "timestamps": {
              "generated_at": "2026-10-12T10:00:00Z"
            }
          }
        ],
        "origins": [
          {
            "id": "origin_c7fe2a2ec62d8bdbde4fa4bb76997336e117466c7150c2fd1b90201ec327ce7c",
            "url": "https://www.youtube.com/watch?v=abcdefghijk"
          }
        ],
        "processing_status": "capture_required",
        "ready": false
      }
    ],
    "observed_at": "2026-10-12T10:02:00Z",
    "scan_finished_at": "2026-10-12T10:02:01Z",
    "schema": "number-one-twib-inventory/v1",
    "snapshot": {
      "allow_deletions": false,
      "candidate_coverage": "partial",
      "complete": true,
      "consistency": "metadata_double_scan_not_atomic",
      "mode": "full",
      "scope": "episode_media_and_allowlisted_local_artifacts"
    },
    "source_id": "nomad:number-one",
    "warnings": [
      "global_history_not_scanned",
      "local_artifacts_only_no_provider_polling",
      "not_atomic_deletions_disabled",
      "readiness_not_evaluated",
      "source_url_redacted:c8dfe37ea60eca3a"
    ]
  }
}
