{"manifest":{"coverage":[],"episode":{"id":"episode_f95f48bf4eac4e84c7becec8aaac50c6cb732f301f170ab709f58a2c961b223b","number":128,"show":"twib"},"idempotency_digest":"sha256:68d8ed9adb34fc924d890a9bc24c541ad48190ddb853769aaa09ceb962b223e4","items":[{"capture_evidence":[{"artifact":"set-aside/json/src-pinboard.mp4.capture.json","content_hash_verified":false,"matches_observed_size":true,"producer_sha256":"487b8d177f4889d2153189cae4319a8a00b3df397e1a27d760bf4fcc2e53e953","streams_reprobed":false}],"id":"item_da1595447405a4358144b0c61c4cf99f077accf7ad64ff61175d826e7ad3d725","kind":"media","media":{"duration_seconds":45.0,"modified_at":"2026-10-19T18:26:18.423779Z","present":true,"ref":"new-review/src-pinboard.mp4","size_bytes":29},"observations":[{"artifact":"new-review/src-pinboard.mp4","context":{"extended":"Original editorial note.","title":"Bookmark title"},"status":"known","timestamps":{}},{"artifact":"new-review/src-pinboard.mp4","context":{"operator_note":"Use the evidence at 00:43.","title":"Source title"},"status":"known","timestamps":{}},{"artifact":"set-aside/json/src-pinboard.mp4.capture.json","context":{},"status":"captured","timestamps":{}}],"origins":[{"id":"origin_c7fe2a2ec62d8bdbde4fa4bb76997336e117466c7150c2fd1b90201ec327ce7c","url":"https://www.youtube.com/watch?v=abcdefghijk"}],"processing_status":"captured_observed","producer_record":{"clip_id":"src-pinboard","first_seen_at":null,"parent_clip_id":null,"record_kind":"processing-history","source_signature":"29:1792434378423778690"},"ready":false}],"observed_at":"2026-10-19T18:26:18.491130Z","scan_finished_at":"2026-10-19T18:26:18.494763Z","schema":"number-one-twib-inventory/v1","snapshot":{"allow_deletions":false,"candidate_coverage":"partial","complete":false,"consistency":"metadata_double_scan_not_atomic","mode":"full","scope":"episode_media_and_allowlisted_local_artifacts"},"source_id":"nomad:number-one","warnings":["native_pinboard_subset"]},"scan_id":"921ab797-f6ac-4d46-884d-a155efebc30a","schema":"number-one-inventory-envelope/v2","sequence":38}