{"schema": "number-one-inventory-envelope/v2", "scan_id": "e584ad6d-c0ba-4847-b984-1144627495fd", "sequence": 1, "manifest": {"coverage": [{"artifact": "transcripts/bookmark-narrative-brief.json", "status": "absent"}, {"artifact": "transcripts/manual-clip-layout.json", "status": "absent"}, {"artifact": "transcripts/prep-manifest.json", "status": "absent"}, {"artifact": "transcripts/safe-intake-supporting-links.json", "status": "absent"}, {"artifact": "transcripts/source-watch.json", "status": "absent"}, {"artifact": "transcripts/supporting-clip-candidates.json", "status": "read"}], "episode": {"id": "episode_616a1ec58e997fd5fb97fa27ec48153b57e83418ab576c463c537533a6f29e72", "number": 127, "show": "twib"}, "idempotency_digest": "sha256:3fe4aaf621965db00fc6fd9431dc595245c6aa3c38ccfd17e50416c85169cc24", "items": [{"id": "item_3e40b9089f4e7e3aaedce00ba568eaf105c636cffe19aab97ef7846e21153387", "kind": "candidate", "media": null, "observations": [{"artifact": "transcripts/supporting-clip-candidates.json", "context": {"title": "Synthetic"}, "status": "candidate", "timestamps": {}}], "origins": [{"id": "origin_b718181f8aab8c9f636de26c6ff07e56bde6aaf0ce3b57875193c147c7402e22", "url": "https://media.home/path"}], "processing_status": "candidate", "ready": false}], "observed_at": "2026-10-12T18:05:41.854632Z", "scan_finished_at": "2026-10-12T18:05:41.855623Z", "schema": "number-one-twib-inventory/v1", "snapshot": {"allow_deletions": false, "candidate_coverage": "partial", "complete": true, "consistency": "metadata_double_scan_not_atomic", "mode": "full", "scope": "episode_media_and_allowlisted_local_artifacts"}, "source_id": "nomad:number-one", "warnings": ["global_history_not_scanned", "local_artifacts_only_no_provider_polling", "not_atomic_deletions_disabled", "readiness_not_evaluated"]}}